{"$schema":"https://json-schema.org/draft/2020-12/schema","type":"object","required":["geometry","controller","observation_request","approval"],"properties":{"geometry":{"type":"object"},"controller":{"type":"object"},"observation_request":{"type":"object"},"approval":{"type":"object","required":["decision","candidate_id"],"properties":{"decision":{"const":"ship"},"candidate_id":{"type":"string"}},"additionalProperties":false}},"additionalProperties":false}
