{
  "approval": {
    "candidate_id": "fc2794e5a88f0319",
    "decision": "ship"
  },
  "controller": {
    "base_speed": 1.5,
    "kd": 0.8,
    "ki": 0.05,
    "kp": 4.0,
    "line_loss": "last_direction",
    "sensor_weights": [
      -2.0,
      -1.0,
      0.0,
      1.0,
      2.0
    ]
  },
  "geometry": {
    "body_length": 0.16,
    "body_width": 0.12,
    "mass": 0.8,
    "sensor_positions": [
      {
        "x": -0.03,
        "y": 0.05
      },
      {
        "x": -0.015,
        "y": 0.05
      },
      {
        "x": 0.0,
        "y": 0.05
      },
      {
        "x": 0.015,
        "y": 0.05
      },
      {
        "x": 0.03,
        "y": 0.05
      }
    ],
    "sensor_size": 0.016,
    "wheel_radius": 0.03,
    "wheel_track": 0.12
  },
  "observation_request": {
    "measurements": [
      "completion",
      "progress",
      "completion_time",
      "rms_error",
      "max_error",
      "line_loss_events",
      "steering_oscillation",
      "control_effort",
      "controller_errors"
    ]
  }
}
